{"app_id":"wallet","nodes":[{"actions":[],"child_count":3,"depth":0,"enabled":true,"id":"wallet.qr","kind":"screen","parent_id":null,"props":{"alignment":"stretch","gap":"none"},"semantics":{"label":"wallet","role":"screen"},"visible":true},{"actions":[],"child_count":0,"depth":1,"enabled":true,"id":"wallet.qr.context","kind":"text","parent_id":"wallet.qr","props":{"alignment":"center","max_lines":1,"primary_text":"SFO / JFK / B12","variant":"label"},"semantics":{"label":"SFO / JFK / B12","role":"text"},"visible":true},{"actions":[],"child_count":0,"depth":1,"enabled":true,"id":"wallet.qr.code","kind":"image","parent_id":"wallet.qr","props":{"primary_text":"29ee6d97e8928b49fbbaa49c20a439a1930c4d82de2217490abbe5235a798254","variant":"contain"},"semantics":{"label":"Demo boarding pass QR code for seat 18A","role":"image"},"visible":true},{"actions":[],"child_count":2,"depth":1,"enabled":true,"id":"wallet.qr.actions","kind":"row","parent_id":"wallet.qr","props":{"alignment":"stretch","gap":"xs"},"semantics":{"label":"","role":"list"},"visible":true},{"actions":[{"action_id":"wallet.done","kind":"tap"}],"child_count":0,"depth":2,"enabled":true,"id":"wallet.qr.primary","kind":"button","parent_id":"wallet.qr.actions","props":{"primary_text":"Done","size":"default","tone":"primary","variant":"filled"},"semantics":{"label":"Return to boarding pass","role":"button"},"visible":true},{"actions":[{"action_id":"wallet.bad","kind":"tap"}],"child_count":0,"depth":2,"enabled":true,"id":"wallet.qr.secondary","kind":"button","parent_id":"wallet.qr.actions","props":{"primary_text":"Test","size":"default","tone":"neutral","variant":"tonal"},"semantics":{"label":"Test an invalid pass update","role":"button"},"visible":true}],"origin":"guest_appspec","schema_version":1,"screen_id":"wallet.qr"}