{"app_id":"sports","nodes":[{"actions":[],"child_count":4,"depth":0,"enabled":true,"id":"sports.live","kind":"screen","parent_id":null,"props":{"alignment":"stretch","gap":"none"},"semantics":{"label":"sports","role":"screen"},"visible":true},{"actions":[],"child_count":0,"depth":1,"enabled":true,"id":"sports.live.context","kind":"text","parent_id":"sports.live","props":{"alignment":"center","max_lines":1,"primary_text":"FOLLOW / TOP 8","variant":"label"},"semantics":{"label":"FOLLOW / TOP 8","role":"text"},"visible":true},{"actions":[],"child_count":0,"depth":1,"enabled":true,"id":"sports.live.summary","kind":"text","parent_id":"sports.live","props":{"alignment":"center","max_lines":1,"primary_text":"3:2","variant":"numeral"},"semantics":{"label":"Followed live baseball game","role":"text","value":"San Francisco 3, Los Angeles 2, top of the eighth"},"visible":true},{"actions":[],"child_count":0,"depth":1,"enabled":true,"id":"sports.live.detail","kind":"live_card","parent_id":"sports.live","props":{"maximum":100,"primary_text":"AT BAT / 1 OUT","secondary_text":"Runners 1st + 2nd","tone":"primary","value":78},"semantics":{"label":"AT BAT / 1 OUT","role":"list_item"},"visible":true},{"actions":[],"child_count":2,"depth":1,"enabled":true,"id":"sports.live.actions","kind":"row","parent_id":"sports.live","props":{"alignment":"stretch","gap":"xs"},"semantics":{"label":"","role":"list"},"visible":true},{"actions":[{"action_id":"sports.burst","kind":"tap"}],"child_count":0,"depth":2,"enabled":true,"id":"sports.live.primary","kind":"button","parent_id":"sports.live.actions","props":{"primary_text":"Update","size":"default","tone":"primary","variant":"filled"},"semantics":{"label":"Deliver latest score update","role":"button"},"visible":true},{"actions":[{"action_id":"sports.unfollow","kind":"tap"}],"child_count":0,"depth":2,"enabled":true,"id":"sports.live.secondary","kind":"button","parent_id":"sports.live.actions","props":{"primary_text":"Stop","size":"default","tone":"neutral","variant":"tonal"},"semantics":{"label":"Stop following game","role":"button"},"visible":true}],"origin":"guest_appspec","schema_version":1,"screen_id":"sports.live"}