{"app_id":"voice-notes","nodes":[{"actions":[],"child_count":3,"depth":0,"enabled":true,"id":"voice-notes.home","kind":"screen","parent_id":null,"props":{"alignment":"stretch","gap":"sm"},"semantics":{"label":"voice-notes","role":"screen"},"visible":true},{"actions":[],"child_count":0,"depth":1,"enabled":true,"id":"voice-notes.summary","kind":"text","parent_id":"voice-notes.home","props":{"alignment":"center","max_lines":2,"primary_text":"Recording ready","variant":"numeral"},"semantics":{"label":"Voice Notes status","role":"text","value":"Recording ready"},"visible":true},{"actions":[],"child_count":0,"depth":1,"enabled":true,"id":"voice-notes.mock","kind":"card","parent_id":"voice-notes.home","props":{"primary_text":"Deterministic provider","secondary_text":"Interactive mock data · revision 1","tone":"neutral"},"semantics":{"label":"Deterministic provider","role":"list_item"},"visible":true},{"actions":[{"action_id":"voice-notes.primary","kind":"tap"}],"child_count":0,"depth":1,"enabled":true,"id":"voice-notes.primary","kind":"button","parent_id":"voice-notes.home","props":{"primary_text":"Record note","size":"default","tone":"primary","variant":"filled"},"semantics":{"label":"Record note","role":"button"},"visible":true}],"origin":"guest_appspec","schema_version":1,"screen_id":"voice-notes.home"}