{"app_id":"weather","nodes":[{"actions":[],"child_count":5,"depth":0,"enabled":true,"id":"weather.home","kind":"screen","parent_id":null,"props":{"alignment":"stretch","gap":"sm"},"semantics":{"label":"weather","role":"screen"},"visible":true},{"actions":[],"child_count":0,"depth":1,"enabled":true,"id":"weather.heading","kind":"text","parent_id":"weather.home","props":{"alignment":"center","max_lines":1,"primary_text":"SAN FRANCISCO","variant":"label"},"semantics":{"label":"SAN FRANCISCO","role":"text"},"visible":true},{"actions":[],"child_count":0,"depth":1,"enabled":true,"id":"weather.summary","kind":"text","parent_id":"weather.home","props":{"alignment":"center","max_lines":1,"primary_text":"71°","variant":"numeral"},"semantics":{"label":"Current temperature","role":"text","value":"72 degrees"},"visible":true},{"actions":[],"child_count":0,"depth":1,"enabled":true,"id":"weather.forecast","kind":"card","parent_id":"weather.home","props":{"primary_text":"Clear","secondary_text":"High 75 - Low 58 - Rain 5%","tone":"neutral"},"semantics":{"label":"Clear","role":"list_item"},"visible":true},{"actions":[],"child_count":0,"depth":1,"enabled":true,"id":"weather.status","kind":"text","parent_id":"weather.home","props":{"alignment":"center","max_lines":1,"primary_text":"Updated now · revision 2","variant":"caption"},"semantics":{"label":"Updated now · revision 2","role":"text"},"visible":true},{"actions":[{"action_id":"weather.refresh","kind":"tap"}],"child_count":0,"depth":1,"enabled":true,"id":"weather.primary","kind":"button","parent_id":"weather.home","props":{"primary_text":"Refresh","size":"default","tone":"primary","variant":"filled"},"semantics":{"label":"Refresh weather","role":"button"},"visible":true}],"origin":"guest_appspec","schema_version":1,"screen_id":"weather.home"}