{"app_id":"media","nodes":[{"actions":[],"child_count":5,"depth":0,"enabled":true,"id":"media.home","kind":"screen","parent_id":null,"props":{"alignment":"stretch","gap":"none"},"semantics":{"label":"media","role":"screen"},"visible":true},{"actions":[],"child_count":0,"depth":1,"enabled":true,"id":"media.artwork","kind":"image","parent_id":"media.home","props":{"primary_text":"2fb9cd65b78719989e685e43a7179cb69f97e1dfb4604ebfad420cfb91d81028","variant":"cover"},"semantics":{"label":"Synthwave city album artwork","role":"image"},"visible":true},{"actions":[],"child_count":0,"depth":1,"enabled":true,"id":"media.summary","kind":"text","parent_id":"media.home","props":{"alignment":"start","max_lines":2,"primary_text":"Midnight City","variant":"title"},"semantics":{"label":"Track","role":"heading","value":"Midnight City"},"visible":true},{"actions":[],"child_count":0,"depth":1,"enabled":true,"id":"media.detail","kind":"text","parent_id":"media.home","props":{"alignment":"start","max_lines":2,"primary_text":"M83 / Living Room","variant":"caption"},"semantics":{"label":"M83 / Living Room","role":"text"},"visible":true},{"actions":[],"child_count":0,"depth":1,"enabled":true,"id":"media.progress","kind":"progress","parent_id":"media.home","props":{"maximum":243,"primary_text":"Track progress","tone":"primary","value":0,"variant":"linear"},"semantics":{"label":"Track progress","role":"progress","value":"0 of 4 minutes 3 seconds"},"visible":true},{"actions":[],"child_count":2,"depth":1,"enabled":true,"id":"media.actions","kind":"row","parent_id":"media.home","props":{"alignment":"stretch","gap":"xs"},"semantics":{"label":"Playback actions","role":"list"},"visible":true},{"actions":[{"action_id":"media.primary","kind":"tap"}],"child_count":0,"depth":2,"enabled":true,"id":"media.primary","kind":"button","parent_id":"media.actions","props":{"primary_text":"Play","size":"large","tone":"primary","variant":"filled"},"semantics":{"label":"Play Midnight City","role":"button"},"visible":true},{"actions":[{"action_id":"media.queue","kind":"tap"}],"child_count":0,"depth":2,"enabled":true,"id":"media.queue","kind":"button","parent_id":"media.actions","props":{"primary_text":"Queue","size":"large","tone":"neutral","variant":"tonal"},"semantics":{"label":"Open queue","role":"button"},"visible":true}],"origin":"guest_appspec","schema_version":1,"screen_id":"media.home"}