{"app_id":"transit","nodes":[{"actions":[],"child_count":5,"depth":0,"enabled":true,"id":"transit.departures","kind":"screen","parent_id":null,"props":{"alignment":"stretch","gap":"sm"},"semantics":{"label":"transit","role":"screen"},"visible":true},{"actions":[],"child_count":0,"depth":1,"enabled":true,"id":"transit.departures.heading","kind":"text","parent_id":"transit.departures","props":{"alignment":"center","max_lines":1,"primary_text":"CASTRO STATION","variant":"label"},"semantics":{"label":"CASTRO STATION","role":"text"},"visible":true},{"actions":[],"child_count":0,"depth":1,"enabled":true,"id":"transit.departures.summary","kind":"text","parent_id":"transit.departures","props":{"alignment":"center","max_lines":2,"primary_text":"N · 3 min","variant":"numeral"},"semantics":{"label":"CASTRO STATION","role":"text","value":"N · 3 min"},"visible":true},{"actions":[],"child_count":0,"depth":1,"enabled":true,"id":"transit.departures.detail","kind":"card","parent_id":"transit.departures","props":{"primary_text":"Deterministic fixture","secondary_text":"N  3 min\nN  14 min\nL  8 min","tone":"neutral"},"semantics":{"label":"Deterministic fixture","role":"list_item"},"visible":true},{"actions":[{"action_id":"transit.offline","kind":"tap"}],"child_count":0,"depth":1,"enabled":true,"id":"transit.departures.primary","kind":"button","parent_id":"transit.departures","props":{"primary_text":"Go offline","size":"default","tone":"primary","variant":"filled"},"semantics":{"label":"Go offline","role":"button"},"visible":true},{"actions":[{"action_id":"transit.alert","kind":"tap"}],"child_count":0,"depth":1,"enabled":true,"id":"transit.departures.secondary","kind":"button","parent_id":"transit.departures","props":{"primary_text":"Service alert","size":"default","tone":"neutral","variant":"outlined"},"semantics":{"label":"Service alert","role":"button"},"visible":true}],"origin":"guest_appspec","schema_version":1,"screen_id":"transit.departures"}