{"app_id":"workout","nodes":[{"actions":[],"child_count":4,"depth":0,"enabled":true,"id":"powerlifting.weight-editor","kind":"screen","parent_id":null,"props":{"alignment":"stretch","gap":"none"},"semantics":{"label":"workout","role":"screen"},"visible":true},{"actions":[],"child_count":0,"depth":1,"enabled":true,"id":"powerlifting.weight-editor.title","kind":"text","parent_id":"powerlifting.weight-editor","props":{"alignment":"center","max_lines":1,"primary_text":"WEIGHT","variant":"label"},"semantics":{"label":"WEIGHT","role":"text"},"visible":true},{"actions":[{"action_id":"workout.weight","kind":"value_committed"}],"child_count":0,"depth":1,"enabled":true,"id":"powerlifting.weight-editor.value","kind":"stepper","parent_id":"powerlifting.weight-editor","props":{"maximum":400,"minimum":20,"primary_text":"Set weight","secondary_text":"KG","step":5,"value":140},"semantics":{"label":"Set weight","role":"slider","value":"140 KG"},"visible":true},{"actions":[],"child_count":0,"depth":1,"enabled":true,"id":"powerlifting.weight-editor.plates","kind":"card","parent_id":"powerlifting.weight-editor","props":{"primary_text":"20 / 20 / 10 / 2.5","secondary_text":"PLATES PER SIDE","tone":"secondary"},"semantics":{"label":"20 / 20 / 10 / 2.5","role":"list_item"},"visible":true},{"actions":[{"action_id":"workout.weight.done","kind":"tap"}],"child_count":0,"depth":1,"enabled":true,"id":"powerlifting.weight-editor.done","kind":"button","parent_id":"powerlifting.weight-editor","props":{"primary_text":"DONE","size":"default","tone":"primary","variant":"filled"},"semantics":{"label":"DONE","role":"button"},"visible":true}],"origin":"guest_appspec","schema_version":1,"screen_id":"powerlifting.weight-editor"}