{"app_id":"smart-home","nodes":[{"actions":[],"child_count":4,"depth":0,"enabled":true,"id":"smart-home.unlocked","kind":"screen","parent_id":null,"props":{"alignment":"stretch","gap":"none"},"semantics":{"label":"smart-home","role":"screen"},"visible":true},{"actions":[],"child_count":0,"depth":1,"enabled":true,"id":"smart-home.unlocked.context","kind":"text","parent_id":"smart-home.unlocked","props":{"alignment":"center","max_lines":1,"primary_text":"DOOR / OPEN","variant":"label"},"semantics":{"label":"DOOR / OPEN","role":"text"},"visible":true},{"actions":[],"child_count":0,"depth":1,"enabled":true,"id":"smart-home.unlocked.summary","kind":"text","parent_id":"smart-home.unlocked","props":{"alignment":"center","max_lines":1,"primary_text":"UNLOCKED","variant":"numeral"},"semantics":{"label":"Front door lock state","role":"text","value":"Unlocked"},"visible":true},{"actions":[],"child_count":0,"depth":1,"enabled":true,"id":"smart-home.unlocked.detail","kind":"live_card","parent_id":"smart-home.unlocked","props":{"maximum":100,"primary_text":"ACCESS / CONFIRMED","secondary_text":"Audit 204 / lock when done","tone":"primary","value":100},"semantics":{"label":"ACCESS / CONFIRMED","role":"list_item"},"visible":true},{"actions":[],"child_count":2,"depth":1,"enabled":true,"id":"smart-home.unlocked.actions","kind":"row","parent_id":"smart-home.unlocked","props":{"alignment":"stretch","gap":"xs"},"semantics":{"label":"","role":"list"},"visible":true},{"actions":[{"action_id":"home.relock","kind":"tap"}],"child_count":0,"depth":2,"enabled":true,"id":"smart-home.unlocked.primary","kind":"button","parent_id":"smart-home.unlocked.actions","props":{"primary_text":"Lock","size":"default","tone":"primary","variant":"filled"},"semantics":{"label":"Lock front door again","role":"button"},"visible":true},{"actions":[{"action_id":"home.home","kind":"tap"}],"child_count":0,"depth":2,"enabled":true,"id":"smart-home.unlocked.secondary","kind":"button","parent_id":"smart-home.unlocked.actions","props":{"primary_text":"Home","size":"default","tone":"neutral","variant":"tonal"},"semantics":{"label":"Return to home favorites","role":"button"},"visible":true}],"origin":"guest_appspec","schema_version":1,"screen_id":"smart-home.unlocked"}