{"app_id":"media","nodes":[{"actions":[],"child_count":3,"depth":0,"enabled":true,"id":"media.home","kind":"screen","parent_id":null,"props":{"alignment":"stretch","gap":"sm"},"semantics":{"label":"media","role":"screen"},"visible":true},{"actions":[],"child_count":0,"depth":1,"enabled":true,"id":"media.summary","kind":"text","parent_id":"media.home","props":{"alignment":"center","max_lines":2,"primary_text":"Now playing","variant":"numeral"},"semantics":{"label":"Media Remote status","role":"text","value":"Now playing"},"visible":true},{"actions":[],"child_count":0,"depth":1,"enabled":true,"id":"media.mock","kind":"card","parent_id":"media.home","props":{"primary_text":"Deterministic provider","secondary_text":"Interactive mock data · revision 1","tone":"neutral"},"semantics":{"label":"Deterministic provider","role":"list_item"},"visible":true},{"actions":[{"action_id":"media.primary","kind":"tap"}],"child_count":0,"depth":1,"enabled":true,"id":"media.primary","kind":"button","parent_id":"media.home","props":{"primary_text":"Play","size":"default","tone":"primary","variant":"filled"},"semantics":{"label":"Play","role":"button"},"visible":true}],"origin":"guest_appspec","schema_version":1,"screen_id":"media.home"}