{"app_id":"workout","nodes":[{"actions":[],"child_count":5,"depth":0,"enabled":true,"id":"powerlifting.rest","kind":"screen","parent_id":null,"props":{"alignment":"stretch","gap":"none"},"semantics":{"label":"workout","role":"screen"},"visible":true},{"actions":[],"child_count":0,"depth":1,"enabled":true,"id":"powerlifting.rest.label","kind":"text","parent_id":"powerlifting.rest","props":{"alignment":"center","max_lines":1,"primary_text":"REST","variant":"label"},"semantics":{"label":"REST","role":"text"},"visible":true},{"actions":[],"child_count":0,"depth":1,"enabled":true,"id":"powerlifting.rest.time","kind":"text","parent_id":"powerlifting.rest","props":{"alignment":"center","max_lines":1,"primary_text":"2:41","variant":"numeral"},"semantics":{"label":"2:41","role":"text"},"visible":true},{"actions":[],"child_count":0,"depth":1,"enabled":true,"id":"powerlifting.rest.progress","kind":"progress","parent_id":"powerlifting.rest","props":{"maximum":180,"primary_text":"Workout progress","tone":"primary","value":19,"variant":"linear"},"semantics":{"label":"Workout progress","role":"progress","value":"19 of 180"},"visible":true},{"actions":[{"action_id":"workout.plates","kind":"tap"},{"action_id":"workout.edit.result","kind":"long_press"}],"child_count":0,"depth":1,"enabled":true,"id":"powerlifting.rest.next","kind":"card","parent_id":"powerlifting.rest","props":{"primary_text":"NEXT  /  142.5 KG X 5","secondary_text":"SET 4 OF 5 / HOLD TO EDIT LAST","tone":"primary"},"semantics":{"label":"NEXT  /  142.5 KG X 5","role":"list_item"},"visible":true},{"actions":[],"child_count":2,"depth":1,"enabled":true,"id":"powerlifting.rest.controls","kind":"row","parent_id":"powerlifting.rest","props":{"alignment":"stretch","gap":"xs"},"semantics":{"label":"","role":"list"},"visible":true},{"actions":[{"action_id":"workout.rest.extend","kind":"tap"}],"child_count":0,"depth":2,"enabled":true,"id":"powerlifting.rest.extend","kind":"button","parent_id":"powerlifting.rest.controls","props":{"primary_text":"+30","size":"compact","tone":"primary","variant":"filled"},"semantics":{"label":"+30","role":"button"},"visible":true},{"actions":[{"action_id":"workout.rest.skip","kind":"tap"}],"child_count":0,"depth":2,"enabled":true,"id":"powerlifting.rest.skip","kind":"button","parent_id":"powerlifting.rest.controls","props":{"primary_text":"SKIP","size":"compact","tone":"neutral","variant":"tonal"},"semantics":{"label":"SKIP","role":"button"},"visible":true}],"origin":"guest_appspec","schema_version":1,"screen_id":"powerlifting.rest"}