{"app_id":"sports","nodes":[{"actions":[],"child_count":4,"depth":0,"enabled":true,"id":"sports.final","kind":"screen","parent_id":null,"props":{"alignment":"stretch","gap":"none"},"semantics":{"label":"sports","role":"screen"},"visible":true},{"actions":[],"child_count":0,"depth":1,"enabled":true,"id":"sports.final.context","kind":"text","parent_id":"sports.final","props":{"alignment":"center","max_lines":1,"primary_text":"FINAL / SF","variant":"label"},"semantics":{"label":"FINAL / SF","role":"text"},"visible":true},{"actions":[],"child_count":0,"depth":1,"enabled":true,"id":"sports.final.summary","kind":"text","parent_id":"sports.final","props":{"alignment":"center","max_lines":1,"primary_text":"5:3","variant":"numeral"},"semantics":{"label":"Final score","role":"text","value":"San Francisco 5, Los Angeles 3"},"visible":true},{"actions":[],"child_count":0,"depth":1,"enabled":true,"id":"sports.final.detail","kind":"live_card","parent_id":"sports.final","props":{"maximum":100,"primary_text":"SF WINS / FINAL","secondary_text":"One alert / follow ended","tone":"primary","value":100},"semantics":{"label":"SF WINS / FINAL","role":"list_item"},"visible":true},{"actions":[],"child_count":2,"depth":1,"enabled":true,"id":"sports.final.actions","kind":"row","parent_id":"sports.final","props":{"alignment":"stretch","gap":"xs"},"semantics":{"label":"","role":"list"},"visible":true},{"actions":[{"action_id":"sports.plays","kind":"tap"}],"child_count":0,"depth":2,"enabled":true,"id":"sports.final.primary","kind":"button","parent_id":"sports.final.actions","props":{"primary_text":"Plays","size":"default","tone":"primary","variant":"filled"},"semantics":{"label":"Show scoring plays","role":"button"},"visible":true},{"actions":[{"action_id":"sports.follow","kind":"tap"}],"child_count":0,"depth":2,"enabled":true,"id":"sports.final.secondary","kind":"button","parent_id":"sports.final.actions","props":{"primary_text":"Again","size":"default","tone":"neutral","variant":"tonal"},"semantics":{"label":"Follow rematch","role":"button"},"visible":true}],"origin":"guest_appspec","schema_version":1,"screen_id":"sports.final"}