{"app_id":"workout","nodes":[{"actions":[],"child_count":4,"depth":0,"enabled":true,"id":"workout.next-set","kind":"screen","parent_id":null,"props":{"alignment":"stretch","gap":"none"},"semantics":{"label":"workout","role":"screen"},"visible":true},{"actions":[],"child_count":0,"depth":1,"enabled":true,"id":"workout.next.heading","kind":"text","parent_id":"workout.next-set","props":{"alignment":"center","max_lines":1,"primary_text":"SQUAT  /  SET 4/5","variant":"label"},"semantics":{"label":"SQUAT  /  SET 4/5","role":"text"},"visible":true},{"actions":[{"action_id":"workout.next.weight","kind":"value_committed"}],"child_count":0,"depth":1,"enabled":true,"id":"workout.next.weight","kind":"stepper","parent_id":"workout.next-set","props":{"maximum":500,"minimum":45,"primary_text":"Weight","secondary_text":"lb","step":5,"value":145},"semantics":{"label":"Next set weight","role":"slider","value":"135 pounds"},"visible":true},{"actions":[],"child_count":0,"depth":1,"enabled":true,"id":"workout.next.target","kind":"live_card","parent_id":"workout.next-set","props":{"maximum":100,"primary_text":"TARGET  /  8 REPS","secondary_text":"Previous set  /  145 lb","tone":"neutral","value":80},"semantics":{"label":"Next set target","role":"list_item","value":"8 reps"},"visible":true},{"actions":[{"action_id":"workout.next.complete","kind":"tap"}],"child_count":0,"depth":1,"enabled":true,"id":"workout.next.complete","kind":"button","parent_id":"workout.next-set","props":{"primary_text":"Log set","size":"default","tone":"primary","variant":"filled"},"semantics":{"label":"Log next set","role":"button"},"visible":true}],"origin":"guest_appspec","schema_version":1,"screen_id":"workout.next-set"}