{"app_id":"workout","nodes":[{"actions":[],"child_count":6,"depth":0,"enabled":true,"id":"powerlifting.active-set","kind":"screen","parent_id":null,"props":{"alignment":"stretch","gap":"none"},"semantics":{"label":"workout","role":"screen"},"visible":true},{"actions":[],"child_count":0,"depth":1,"enabled":true,"id":"powerlifting.active-set.exercise","kind":"text","parent_id":"powerlifting.active-set","props":{"alignment":"center","max_lines":1,"primary_text":"BACK SQUAT","variant":"label"},"semantics":{"label":"BACK SQUAT","role":"text"},"visible":true},{"actions":[],"child_count":0,"depth":1,"enabled":true,"id":"powerlifting.active-set.set","kind":"text","parent_id":"powerlifting.active-set","props":{"alignment":"center","max_lines":1,"primary_text":"SET 3 OF 5","variant":"caption"},"semantics":{"label":"SET 3 OF 5","role":"text"},"visible":true},{"actions":[],"child_count":0,"depth":1,"enabled":true,"id":"powerlifting.active-set.progress","kind":"progress","parent_id":"powerlifting.active-set","props":{"maximum":5,"primary_text":"Workout progress","tone":"primary","value":3,"variant":"linear"},"semantics":{"label":"Workout progress","role":"progress","value":"3 of 5"},"visible":true},{"actions":[{"action_id":"workout.edit.weight","kind":"tap"}],"child_count":0,"depth":1,"enabled":true,"id":"powerlifting.active-set.target","kind":"card","parent_id":"powerlifting.active-set","props":{"primary_text":"140 KG  X  5","secondary_text":"TARGET SET","tone":"primary"},"semantics":{"label":"140 KG  X  5","role":"list_item"},"visible":true},{"actions":[],"child_count":0,"depth":1,"enabled":true,"id":"powerlifting.active-set.previous","kind":"card","parent_id":"powerlifting.active-set","props":{"primary_text":"LAST  /  137.5 KG X 5 @8","secondary_text":"PREVIOUS PERFORMANCE","tone":"neutral"},"semantics":{"label":"LAST  /  137.5 KG X 5 @8","role":"list_item"},"visible":true},{"actions":[{"action_id":"workout.complete","kind":"tap"},{"action_id":"workout.switch.preview","kind":"long_press"}],"child_count":0,"depth":1,"enabled":true,"id":"powerlifting.active-set.complete","kind":"button","parent_id":"powerlifting.active-set","props":{"primary_text":"COMPLETE SET","size":"default","tone":"primary","variant":"filled"},"semantics":{"label":"COMPLETE SET","role":"button"},"visible":true}],"origin":"guest_appspec","schema_version":1,"screen_id":"powerlifting.active-set"}