{"app_id":"remote-control","nodes":[{"actions":[],"child_count":5,"depth":0,"enabled":true,"id":"remote-control.offline","kind":"screen","parent_id":null,"props":{"alignment":"stretch","gap":"sm"},"semantics":{"label":"remote-control","role":"screen"},"visible":true},{"actions":[],"child_count":0,"depth":1,"enabled":true,"id":"remote-control.offline.heading","kind":"text","parent_id":"remote-control.offline","props":{"alignment":"center","max_lines":1,"primary_text":"DISCONNECTED","variant":"label"},"semantics":{"label":"DISCONNECTED","role":"text"},"visible":true},{"actions":[],"child_count":0,"depth":1,"enabled":true,"id":"remote-control.offline.summary","kind":"text","parent_id":"remote-control.offline","props":{"alignment":"center","max_lines":2,"primary_text":"No action sent","variant":"numeral"},"semantics":{"label":"DISCONNECTED","role":"text","value":"No action sent"},"visible":true},{"actions":[],"child_count":0,"depth":1,"enabled":true,"id":"remote-control.offline.detail","kind":"card","parent_id":"remote-control.offline","props":{"primary_text":"Deterministic fixture","secondary_text":"Retry ledger preserved · discovery active","tone":"neutral"},"semantics":{"label":"Deterministic fixture","role":"list_item"},"visible":true},{"actions":[{"action_id":"remote.reconnect","kind":"tap"}],"child_count":0,"depth":1,"enabled":true,"id":"remote-control.offline.primary","kind":"button","parent_id":"remote-control.offline","props":{"primary_text":"Reconnect","size":"default","tone":"primary","variant":"filled"},"semantics":{"label":"Reconnect","role":"button"},"visible":true},{"actions":[{"action_id":"remote.home","kind":"tap"}],"child_count":0,"depth":1,"enabled":true,"id":"remote-control.offline.secondary","kind":"button","parent_id":"remote-control.offline","props":{"primary_text":"Home","size":"default","tone":"neutral","variant":"outlined"},"semantics":{"label":"Home","role":"button"},"visible":true}],"origin":"guest_appspec","schema_version":1,"screen_id":"remote-control.offline"}