{"app_id":"transit","nodes":[{"actions":[],"child_count":4,"depth":0,"enabled":true,"id":"transit.home","kind":"screen","parent_id":null,"props":{"alignment":"stretch","gap":"none"},"semantics":{"label":"transit","role":"screen"},"visible":true},{"actions":[],"child_count":0,"depth":1,"enabled":true,"id":"transit.home.context","kind":"text","parent_id":"transit.home","props":{"alignment":"center","max_lines":1,"primary_text":"CASTRO / NORTH","variant":"label"},"semantics":{"label":"CASTRO / NORTH","role":"text"},"visible":true},{"actions":[],"child_count":0,"depth":1,"enabled":true,"id":"transit.summary","kind":"text","parent_id":"transit.home","props":{"alignment":"center","max_lines":1,"primary_text":"3 MIN","variant":"numeral"},"semantics":{"label":"Next northbound N train","role":"text","value":"3 minutes"},"visible":true},{"actions":[],"child_count":0,"depth":1,"enabled":true,"id":"transit.home.detail","kind":"live_card","parent_id":"transit.home","props":{"maximum":100,"primary_text":"N TRAIN / PLATFORM 2","secondary_text":"Next 14 / L in 8 min","tone":"primary","value":20},"semantics":{"label":"N TRAIN / PLATFORM 2","role":"list_item"},"visible":true},{"actions":[],"child_count":2,"depth":1,"enabled":true,"id":"transit.home.actions","kind":"row","parent_id":"transit.home","props":{"alignment":"stretch","gap":"xs"},"semantics":{"label":"","role":"list"},"visible":true},{"actions":[{"action_id":"transit.primary","kind":"tap"}],"child_count":0,"depth":2,"enabled":true,"id":"transit.primary","kind":"button","parent_id":"transit.home.actions","props":{"primary_text":"Times","size":"default","tone":"primary","variant":"filled"},"semantics":{"label":"View Castro departures","role":"button"},"visible":true},{"actions":[{"action_id":"transit.alert","kind":"tap"}],"child_count":0,"depth":2,"enabled":true,"id":"transit.home.alert","kind":"button","parent_id":"transit.home.actions","props":{"primary_text":"Alert","size":"default","tone":"neutral","variant":"tonal"},"semantics":{"label":"View N line service alert","role":"button"},"visible":true}],"origin":"guest_appspec","schema_version":1,"screen_id":"transit.home"}