{"app_id":"weather","nodes":[{"actions":[{"action_id":"weather.page-changed","kind":"page_changed"}],"child_count":1,"depth":0,"enabled":true,"id":"weather.rain-screen","kind":"screen","parent_id":null,"props":{"alignment":"stretch","gap":"none"},"semantics":{"label":"Imminent rain","role":"screen"},"visible":true},{"actions":[],"child_count":4,"depth":1,"enabled":true,"id":"weather.rain-page","kind":"column","parent_id":"weather.rain-screen","props":{"alignment":"stretch","gap":"none"},"semantics":{"label":"Imminent rain","role":"list"},"visible":true},{"actions":[],"child_count":0,"depth":2,"enabled":true,"id":"weather.rain-hero","kind":"icon","parent_id":"weather.rain-page","props":{"icon":"condition_rain","size":"hero","tone":"primary"},"semantics":{"label":"Rain","role":"image"},"visible":true},{"actions":[],"child_count":2,"depth":2,"enabled":true,"id":"weather.rain-headline","kind":"column","parent_id":"weather.rain-page","props":{"alignment":"start","gap":"none"},"semantics":{"label":"","role":"list"},"visible":true},{"actions":[],"child_count":0,"depth":3,"enabled":true,"id":"weather.rain-title","kind":"text","parent_id":"weather.rain-headline","props":{"alignment":"center","max_lines":2,"primary_text":"Rain in\n20 min","variant":"title"},"semantics":{"label":"Rain in 20 minutes","role":"heading"},"visible":true},{"actions":[],"child_count":0,"depth":3,"enabled":true,"id":"weather.rain-duration","kind":"text","parent_id":"weather.rain-headline","props":{"alignment":"center","max_lines":1,"primary_text":"Light rain for 35 min","variant":"caption"},"semantics":{"label":"Light rain for 35 min","role":"text"},"visible":true},{"actions":[],"child_count":3,"depth":2,"enabled":true,"id":"weather.rain-chart-card","kind":"surface","parent_id":"weather.rain-page","props":{"alignment":"stretch","gap":"none","tone":"secondary","variant":"standard"},"semantics":{"label":"","role":"group"},"visible":true},{"actions":[],"child_count":3,"depth":3,"enabled":true,"id":"weather.rain-probability","kind":"row","parent_id":"weather.rain-chart-card","props":{"alignment":"center","gap":"xs"},"semantics":{"label":"","role":"list"},"visible":true},{"actions":[],"child_count":0,"depth":4,"enabled":true,"id":"weather.rain-probability-icon","kind":"icon","parent_id":"weather.rain-probability","props":{"icon":"utility_humidity","size":"large","tone":"primary"},"semantics":{"label":"Chance of rain","role":"image"},"visible":true},{"actions":[],"child_count":0,"depth":4,"enabled":true,"id":"weather.rain-probability-value","kind":"text","parent_id":"weather.rain-probability","props":{"alignment":"center","max_lines":1,"primary_text":"32%","variant":"numeral"},"semantics":{"label":"32 percent","role":"text"},"visible":true},{"actions":[],"child_count":0,"depth":4,"enabled":true,"id":"weather.rain-probability-label","kind":"text","parent_id":"weather.rain-probability","props":{"alignment":"center","max_lines":2,"primary_text":"Chance\nof rain","variant":"caption"},"semantics":{"label":"Chance\nof rain","role":"text"},"visible":true},{"actions":[],"child_count":0,"depth":3,"enabled":true,"id":"weather.rain-bars","kind":"chart","parent_id":"weather.rain-chart-card","props":{"maximum":100,"samples":[4,8,15,24,35,48,62,72,68,55,39,22,9],"tone":"primary","variant":"bars"},"semantics":{"label":"Rain chance peaks near 72 percent in 30 minutes","role":"image"},"visible":true},{"actions":[],"child_count":4,"depth":3,"enabled":true,"id":"weather.rain-times","kind":"row","parent_id":"weather.rain-chart-card","props":{"alignment":"stretch","gap":"none"},"semantics":{"label":"","role":"list"},"visible":true},{"actions":[],"child_count":0,"depth":4,"enabled":true,"id":"weather.rain-time-now","kind":"text","parent_id":"weather.rain-times","props":{"alignment":"start","max_lines":1,"primary_text":"NOW","variant":"caption"},"semantics":{"label":"NOW","role":"text"},"visible":true},{"actions":[],"child_count":0,"depth":4,"enabled":true,"id":"weather.rain-time-20","kind":"text","parent_id":"weather.rain-times","props":{"alignment":"center","max_lines":1,"primary_text":"20m","variant":"caption"},"semantics":{"label":"20m","role":"text"},"visible":true},{"actions":[],"child_count":0,"depth":4,"enabled":true,"id":"weather.rain-time-40","kind":"text","parent_id":"weather.rain-times","props":{"alignment":"center","max_lines":1,"primary_text":"40m","variant":"caption"},"semantics":{"label":"40m","role":"text"},"visible":true},{"actions":[],"child_count":0,"depth":4,"enabled":true,"id":"weather.rain-time-60","kind":"text","parent_id":"weather.rain-times","props":{"alignment":"end","max_lines":1,"primary_text":"60m","variant":"caption"},"semantics":{"label":"60m","role":"text"},"visible":true},{"actions":[],"child_count":2,"depth":2,"enabled":true,"id":"weather.rain-actions","kind":"row","parent_id":"weather.rain-page","props":{"alignment":"start","gap":"none"},"semantics":{"label":"","role":"list"},"visible":true},{"actions":[{"action_id":"weather.rain-details","kind":"tap"}],"child_count":0,"depth":3,"enabled":true,"id":"weather.rain-details","kind":"button","parent_id":"weather.rain-actions","props":{"icon":"utility_details","primary_text":"Details","size":"compact","tone":"primary","variant":"filled"},"semantics":{"label":"Show weather details","role":"button"},"visible":true},{"actions":[{"action_id":"weather.retry","kind":"tap"}],"child_count":0,"depth":3,"enabled":true,"id":"weather.rain-status","kind":"button","parent_id":"weather.rain-actions","props":{"icon":"utility_clock","primary_text":"Now","size":"compact","tone":"neutral","variant":"text"},"semantics":{"label":"Weather updated now","role":"button"},"visible":true}],"origin":"guest_appspec","schema_version":1,"screen_id":"weather.rain-screen"}