{"app_id":"remote-control","nodes":[{"actions":[],"child_count":5,"depth":0,"enabled":true,"id":"remote-control.done","kind":"screen","parent_id":null,"props":{"alignment":"stretch","gap":"sm"},"semantics":{"label":"remote-control","role":"screen"},"visible":true},{"actions":[],"child_count":0,"depth":1,"enabled":true,"id":"remote-control.done.heading","kind":"text","parent_id":"remote-control.done","props":{"alignment":"center","max_lines":1,"primary_text":"CAMERA","variant":"label"},"semantics":{"label":"CAMERA","role":"text"},"visible":true},{"actions":[],"child_count":0,"depth":1,"enabled":true,"id":"remote-control.done.summary","kind":"text","parent_id":"remote-control.done","props":{"alignment":"center","max_lines":2,"primary_text":"Captured ✓","variant":"numeral"},"semantics":{"label":"CAMERA","role":"text","value":"Captured ✓"},"visible":true},{"actions":[],"child_count":0,"depth":1,"enabled":true,"id":"remote-control.done.detail","kind":"card","parent_id":"remote-control.done","props":{"primary_text":"Deterministic fixture","secondary_text":"Command #73 applied exactly once","tone":"neutral"},"semantics":{"label":"Deterministic fixture","role":"list_item"},"visible":true},{"actions":[{"action_id":"remote.camera","kind":"tap"}],"child_count":0,"depth":1,"enabled":true,"id":"remote-control.done.primary","kind":"button","parent_id":"remote-control.done","props":{"primary_text":"Capture again","size":"default","tone":"primary","variant":"filled"},"semantics":{"label":"Capture again","role":"button"},"visible":true},{"actions":[{"action_id":"remote.targets","kind":"tap"}],"child_count":0,"depth":1,"enabled":true,"id":"remote-control.done.secondary","kind":"button","parent_id":"remote-control.done","props":{"primary_text":"Targets","size":"default","tone":"neutral","variant":"outlined"},"semantics":{"label":"Targets","role":"button"},"visible":true}],"origin":"guest_appspec","schema_version":1,"screen_id":"remote-control.done"}