{"app_id":"notifications","nodes":[{"actions":[],"child_count":1,"depth":0,"enabled":true,"id":"notifications.inbox","kind":"screen","parent_id":null,"props":{"alignment":"stretch","gap":"sm"},"semantics":{"label":"notifications","role":"screen"},"visible":true},{"actions":[],"child_count":3,"depth":1,"enabled":true,"id":"notifications.stack","kind":"scroll","parent_id":"notifications.inbox","props":{"alignment":"stretch","gap":"sm"},"semantics":{"label":"","role":"list"},"visible":true},{"actions":[],"child_count":0,"depth":2,"enabled":true,"id":"notifications.summary","kind":"text","parent_id":"notifications.stack","props":{"alignment":"center","max_lines":1,"primary_text":"1 unread","variant":"label"},"semantics":{"label":"1 unread","role":"text"},"visible":true},{"actions":[{"action_id":"notification.open.build","kind":"tap"}],"child_count":0,"depth":2,"enabled":true,"id":"notifications.build","kind":"card","parent_id":"notifications.stack","props":{"primary_text":"Buildbot  4 MIN","secondary_text":"Release build passed.","tone":"neutral"},"semantics":{"label":"Open build notification","role":"list_item"},"visible":true},{"actions":[{"action_id":"notification.clear","kind":"tap"}],"child_count":0,"depth":2,"enabled":true,"id":"notifications.clear","kind":"button","parent_id":"notifications.stack","props":{"primary_text":"Clear all","size":"default","tone":"neutral","variant":"text"},"semantics":{"label":"Clear all notifications","role":"button"},"visible":true}],"origin":"guest_appspec","schema_version":1,"screen_id":"notifications.inbox"}