{"app_id":"voice-notes","nodes":[{"actions":[],"child_count":4,"depth":0,"enabled":true,"id":"voice-notes.recording","kind":"screen","parent_id":null,"props":{"alignment":"stretch","gap":"none"},"semantics":{"label":"voice-notes","role":"screen"},"visible":true},{"actions":[],"child_count":0,"depth":1,"enabled":true,"id":"voice-notes.recording.heading","kind":"text","parent_id":"voice-notes.recording","props":{"alignment":"center","max_lines":1,"primary_text":"REC / LOCAL","variant":"label"},"semantics":{"label":"REC / LOCAL","role":"text"},"visible":true},{"actions":[],"child_count":0,"depth":1,"enabled":true,"id":"voice-notes.recording.summary","kind":"text","parent_id":"voice-notes.recording","props":{"alignment":"center","max_lines":1,"primary_text":"00:18","variant":"numeral"},"semantics":{"label":"Recording elapsed time","role":"text","value":"00:18"},"visible":true},{"actions":[],"child_count":0,"depth":1,"enabled":true,"id":"voice-notes.recording.detail","kind":"live_card","parent_id":"voice-notes.recording","props":{"maximum":100,"primary_text":"SAFE / 3 CHUNKS","secondary_text":"On watch / sleeps safely","tone":"primary","value":60},"semantics":{"label":"SAFE / 3 CHUNKS","role":"list_item"},"visible":true},{"actions":[],"child_count":2,"depth":1,"enabled":true,"id":"voice-notes.recording.actions","kind":"row","parent_id":"voice-notes.recording","props":{"alignment":"stretch","gap":"xs"},"semantics":{"label":"","role":"list"},"visible":true},{"actions":[{"action_id":"voice-notes.finish-capture","kind":"tap"}],"child_count":0,"depth":2,"enabled":true,"id":"voice-notes.recording.finish","kind":"button","parent_id":"voice-notes.recording.actions","props":{"primary_text":"Finish","size":"default","tone":"primary","variant":"filled"},"semantics":{"label":"Finish recording","role":"button"},"visible":true},{"actions":[{"action_id":"voice-notes.pause","kind":"tap"}],"child_count":0,"depth":2,"enabled":true,"id":"voice-notes.recording.pause","kind":"button","parent_id":"voice-notes.recording.actions","props":{"primary_text":"Pause","size":"default","tone":"neutral","variant":"tonal"},"semantics":{"label":"Pause recording","role":"button"},"visible":true}],"origin":"guest_appspec","schema_version":1,"screen_id":"voice-notes.recording"}