{"app_id":"snake","nodes":[{"actions":[],"child_count":4,"depth":0,"enabled":true,"id":"snake.game","kind":"screen","parent_id":null,"props":{"alignment":"stretch","gap":"none"},"semantics":{"label":"snake","role":"screen"},"visible":true},{"actions":[{"action_id":"snake.step","kind":"tap"}],"child_count":0,"depth":1,"enabled":true,"id":"snake.game.canvas","kind":"canvas","parent_id":"snake.game","props":{"display_list":"v1|C0|R1,4,4,120,120,18|T2,8,8,14,14,8,8,0000000000000000000000000022340000000000000000000000000000000000","height":128,"palette":"07110d,10271c,52d88b,a8f279,ffcf66","width":184},"semantics":{"hint":"Tap the board to move forward","label":"Snake game board","role":"canvas"},"visible":true},{"actions":[],"child_count":0,"depth":1,"enabled":true,"id":"snake.game.score-label","kind":"text","parent_id":"snake.game","props":{"alignment":"center","max_lines":1,"primary_text":"SCORE","variant":"label"},"semantics":{"label":"SCORE","role":"text"},"visible":true},{"actions":[],"child_count":0,"depth":1,"enabled":true,"id":"snake.game.score","kind":"text","parent_id":"snake.game","props":{"alignment":"center","max_lines":1,"primary_text":"0","variant":"numeral"},"semantics":{"label":"Snake score","role":"text","value":"0"},"visible":true},{"actions":[{"action_id":"snake.control","kind":"tap"}],"child_count":0,"depth":1,"enabled":true,"id":"snake.game.controls","kind":"keypad","parent_id":"snake.game","props":{"key_columns":3,"keys":["L","GO","R"]},"semantics":{"label":"Snake direction controls","role":"button"},"visible":true}],"origin":"guest_appspec","schema_version":1,"screen_id":"snake.game"}