{"app_id":"workout","nodes":[{"actions":[],"child_count":4,"depth":0,"enabled":true,"id":"powerlifting.set-result","kind":"screen","parent_id":null,"props":{"alignment":"stretch","gap":"none"},"semantics":{"label":"workout","role":"screen"},"visible":true},{"actions":[],"child_count":0,"depth":1,"enabled":true,"id":"powerlifting.set-result.summary","kind":"card","parent_id":"powerlifting.set-result","props":{"primary_text":"SET 3  /  140 KG","secondary_text":"RECORD ACTUAL RESULT","tone":"primary"},"semantics":{"label":"SET 3  /  140 KG","role":"list_item"},"visible":true},{"actions":[{"action_id":"workout.reps","kind":"value_committed"}],"child_count":0,"depth":1,"enabled":true,"id":"powerlifting.set-result.reps","kind":"stepper","parent_id":"powerlifting.set-result","props":{"maximum":20,"minimum":0,"primary_text":"Reps","secondary_text":"REPS","step":1,"value":3},"semantics":{"label":"Reps","role":"slider","value":"5 REPS"},"visible":true},{"actions":[],"child_count":4,"depth":1,"enabled":true,"id":"powerlifting.set-result.rpe","kind":"row","parent_id":"powerlifting.set-result","props":{"alignment":"stretch","gap":"xs"},"semantics":{"label":"","role":"list"},"visible":true},{"actions":[{"action_id":"workout.rpe.7","kind":"tap"}],"child_count":0,"depth":2,"enabled":true,"id":"powerlifting.set-result.rpe-7","kind":"button","parent_id":"powerlifting.set-result.rpe","props":{"primary_text":"7","size":"compact","tone":"neutral","variant":"tonal"},"semantics":{"label":"7","role":"button"},"visible":true},{"actions":[{"action_id":"workout.rpe.8","kind":"tap"}],"child_count":0,"depth":2,"enabled":true,"id":"powerlifting.set-result.rpe-8","kind":"button","parent_id":"powerlifting.set-result.rpe","props":{"primary_text":"8","size":"compact","tone":"neutral","variant":"tonal"},"semantics":{"label":"8","role":"button"},"visible":true},{"actions":[{"action_id":"workout.rpe.9","kind":"tap"}],"child_count":0,"depth":2,"enabled":true,"id":"powerlifting.set-result.rpe-9","kind":"button","parent_id":"powerlifting.set-result.rpe","props":{"primary_text":"9","size":"compact","tone":"neutral","variant":"tonal"},"semantics":{"label":"9","role":"button"},"visible":true},{"actions":[{"action_id":"workout.rpe.10","kind":"tap"}],"child_count":0,"depth":2,"enabled":true,"id":"powerlifting.set-result.rpe-10","kind":"button","parent_id":"powerlifting.set-result.rpe","props":{"primary_text":"10","size":"compact","tone":"neutral","variant":"tonal"},"semantics":{"label":"10","role":"button"},"visible":true},{"actions":[{"action_id":"workout.save","kind":"tap"}],"child_count":0,"depth":1,"enabled":true,"id":"powerlifting.set-result.save","kind":"button","parent_id":"powerlifting.set-result","props":{"primary_text":"SAVE SET","size":"default","tone":"primary","variant":"filled"},"semantics":{"label":"SAVE SET","role":"button"},"visible":true}],"origin":"guest_appspec","schema_version":1,"screen_id":"powerlifting.set-result"}