{"app_id":"transit","nodes":[{"actions":[],"child_count":5,"depth":0,"enabled":true,"id":"transit.stale","kind":"screen","parent_id":null,"props":{"alignment":"stretch","gap":"sm"},"semantics":{"label":"transit","role":"screen"},"visible":true},{"actions":[],"child_count":0,"depth":1,"enabled":true,"id":"transit.stale.heading","kind":"text","parent_id":"transit.stale","props":{"alignment":"center","max_lines":1,"primary_text":"CACHED DEPARTURES","variant":"label"},"semantics":{"label":"CACHED DEPARTURES","role":"text"},"visible":true},{"actions":[],"child_count":0,"depth":1,"enabled":true,"id":"transit.stale.summary","kind":"text","parent_id":"transit.stale","props":{"alignment":"center","max_lines":2,"primary_text":"N · 2 min","variant":"numeral"},"semantics":{"label":"CACHED DEPARTURES","role":"text","value":"N · 2 min"},"visible":true},{"actions":[],"child_count":0,"depth":1,"enabled":true,"id":"transit.stale.detail","kind":"card","parent_id":"transit.stale","props":{"primary_text":"Deterministic fixture","secondary_text":"18 minutes old · refreshing…","tone":"neutral"},"semantics":{"label":"Deterministic fixture","role":"list_item"},"visible":true},{"actions":[{"action_id":"transit.reconnect","kind":"tap"}],"child_count":0,"depth":1,"enabled":true,"id":"transit.stale.primary","kind":"button","parent_id":"transit.stale","props":{"primary_text":"Reconnect","size":"default","tone":"primary","variant":"filled"},"semantics":{"label":"Reconnect","role":"button"},"visible":true},{"actions":[{"action_id":"transit.cache","kind":"tap"}],"child_count":0,"depth":1,"enabled":true,"id":"transit.stale.secondary","kind":"button","parent_id":"transit.stale","props":{"primary_text":"Keep cache","size":"default","tone":"neutral","variant":"outlined"},"semantics":{"label":"Keep cache","role":"button"},"visible":true}],"origin":"guest_appspec","schema_version":1,"screen_id":"transit.stale"}