{"app_id":"voice-notes","nodes":[{"actions":[],"child_count":4,"depth":0,"enabled":true,"id":"voice-notes.buffered","kind":"screen","parent_id":null,"props":{"alignment":"stretch","gap":"none"},"semantics":{"label":"voice-notes","role":"screen"},"visible":true},{"actions":[],"child_count":0,"depth":1,"enabled":true,"id":"voice-notes.buffered.heading","kind":"text","parent_id":"voice-notes.buffered","props":{"alignment":"center","max_lines":1,"primary_text":"CAPTURED","variant":"label"},"semantics":{"label":"CAPTURED","role":"text"},"visible":true},{"actions":[],"child_count":0,"depth":1,"enabled":true,"id":"voice-notes.buffered.summary","kind":"text","parent_id":"voice-notes.buffered","props":{"alignment":"center","max_lines":1,"primary_text":"00:31","variant":"numeral"},"semantics":{"label":"Captured audio duration","role":"text","value":"00:31"},"visible":true},{"actions":[],"child_count":0,"depth":1,"enabled":true,"id":"voice-notes.buffered.detail","kind":"live_card","parent_id":"voice-notes.buffered","props":{"maximum":100,"primary_text":"READY / TRANSCRIBE","secondary_text":"Local audio / 3 chunks","tone":"primary","value":100},"semantics":{"label":"READY / TRANSCRIBE","role":"list_item"},"visible":true},{"actions":[],"child_count":2,"depth":1,"enabled":true,"id":"voice-notes.buffered.actions","kind":"row","parent_id":"voice-notes.buffered","props":{"alignment":"stretch","gap":"xs"},"semantics":{"label":"","role":"list"},"visible":true},{"actions":[{"action_id":"voice-notes.transcribe","kind":"tap"}],"child_count":0,"depth":2,"enabled":true,"id":"voice-notes.buffered.transcribe","kind":"button","parent_id":"voice-notes.buffered.actions","props":{"primary_text":"Text","size":"default","tone":"primary","variant":"filled"},"semantics":{"label":"Transcribe captured note","role":"button"},"visible":true},{"actions":[{"action_id":"voice-notes.delete","kind":"tap"}],"child_count":0,"depth":2,"enabled":true,"id":"voice-notes.buffered.delete","kind":"button","parent_id":"voice-notes.buffered.actions","props":{"primary_text":"Delete","size":"default","tone":"neutral","variant":"tonal"},"semantics":{"label":"Delete captured note","role":"button"},"visible":true}],"origin":"guest_appspec","schema_version":1,"screen_id":"voice-notes.buffered"}