{"app_id":"notifications","nodes":[{"actions":[],"child_count":4,"depth":0,"enabled":true,"id":"notifications.inbox","kind":"screen","parent_id":null,"props":{"alignment":"stretch","gap":"md"},"semantics":{"label":"notifications","role":"screen"},"visible":true},{"actions":[],"child_count":0,"depth":1,"enabled":true,"id":"notifications.heading","kind":"text","parent_id":"notifications.inbox","props":{"alignment":"center","max_lines":1,"primary_text":"INBOX","variant":"label"},"semantics":{"label":"INBOX","role":"text"},"visible":true},{"actions":[],"child_count":0,"depth":1,"enabled":true,"id":"notifications.summary","kind":"text","parent_id":"notifications.inbox","props":{"alignment":"center","max_lines":1,"primary_text":"1 unread","variant":"title"},"semantics":{"label":"1 unread","role":"heading"},"visible":true},{"actions":[{"action_id":"notification.open.build","kind":"tap"}],"child_count":0,"depth":1,"enabled":true,"id":"notifications.build","kind":"button","parent_id":"notifications.inbox","props":{"primary_text":"CI · Build finished","size":"default","tone":"neutral","variant":"tonal"},"semantics":{"label":"Open build notification","role":"button"},"visible":true},{"actions":[{"action_id":"notification.clear","kind":"tap"}],"child_count":0,"depth":1,"enabled":true,"id":"notifications.clear","kind":"button","parent_id":"notifications.inbox","props":{"primary_text":"Clear all","size":"compact","tone":"neutral","variant":"text"},"semantics":{"label":"Clear all notifications","role":"button"},"visible":true}],"origin":"guest_appspec","schema_version":1,"screen_id":"notifications.inbox"}